"編號",附議時間,居住縣市,鄉鎮市區,附議人匿稱,附議原因
No.1,2017-03-30 10:28:57,臺北市,北投區,黑馬騎士,"白雪公主困在城堡上，眾多王子前往營救；
白髮老人困在舊公寓，萬千年輕人無人理。"
No.2,2017-03-30 11:02:28,臺北市,北投區,白髮老人,"補助興建電梯的費用更高，
不如補助購置爬梯機！"
No.3,2017-03-30 13:57:14,臺北市,南港區,路人,"晶華飯店樓梯接連摔人,且摔的都是高齡
真的很希望有法律在飯店先推廣"
No.4,2017-04-02 16:49:10,臺北市,內湖區,來按讚,因為家中之前有長輩不良於行，台北住公寓者要讓不良於行的長輩下樓是一個很麻煩的事。
No.5,2017-04-02 18:53:57,高雄市,大樹區,Ive,
No.6,2017-04-02 23:36:05,新北市,板橋區,Karidasp,
No.7,2017-04-05 11:21:22,臺中市,南屯區,Jerome,
No.8,2017-04-19 20:39:49,新竹縣,橫山鄉,Rebecca,如果在80分鐘內要寫完兩篇文章，其實時間是非常不足夠的，不但沒辦法統整自己的想法，使文章更完整，反而失去考作文的意義。我認為考作文不是在考你寫的多不多，而是在考你是否有自己的寫作風格，考生應該有一個輕鬆且自在的考試空間。
No.9,2017-05-02 12:28:26,新北市,永和區,COMEE,
