"編號",附議時間,居住縣市,鄉鎮市區,附議人匿稱,附議原因
No.1,2017-10-04 00:23:38,臺南市,安南區,威廷,支持！
No.2,2017-10-04 12:37:31,臺中市,潭子區,yy,
No.3,2017-10-04 13:03:09,新北市,汐止區,甯,反對全國國中小裝冷氣，這無疑是殘害國家幼苗的不智行為，愛之適足以害之！夏日就是要盡量多排汗(排寒)，卻讓孩子天天吹冷氣???大人們請清醒吧
No.4,2017-10-04 15:00:07,臺北市,大安區,Serene,
No.5,2017-10-04 15:16:03,新北市,新莊區,TINLU,進冷氣房猶如進冰箱，孩子們的身體將因此失去自我調節溫度的能力，過敏體質就此養成。
No.6,2017-10-04 16:44:42,臺北市,中正區,小可,
No.7,2017-10-04 18:15:39,新北市,新莊區,燒燒,"我以前都沒吹
也很健康"
No.8,2017-10-04 22:44:31,臺南市,東區,Irene,誇張！
No.9,2017-10-05 02:18:51,臺北市,北投區,溫溫,支持。尋求冷氣之外的方法很不錯，可以學習關心、改善所處的環境，也滿足自己的需求。
No.10,2017-10-05 05:24:17,新北市,三峽區,Grace,"一、站在政府資源有限及節能減碳的立場，反對全國中小學教室裝冷氣，因為冷氣非常耗電，是生活中6大「超級」吃電怪獸的第1名。請參見https://www.cmoney.tw/notes/note-detail.aspx?nid=59560。

二、電風扇可以消暑又較省電。吹冷氣很容易過敏，電風扇對身體健康比較好。請參見https://tw.answers.yahoo.com/question/index?qid=20100518000015KK02713。"
No.11,2017-10-05 13:34:54,花蓮縣,花蓮市,clares,
No.12,2017-10-05 20:35:23,新北市,新莊區,Lucy,
No.13,2017-10-05 20:44:36,臺北市,中正區,Katrina,愛護地球，培養下一代忍耐的能力，我反對全面安裝冷氣
No.14,2017-10-05 22:36:16,新北市,淡水區,林禹劭,
No.15,2017-10-05 22:46:15,臺北市,文山區,Letitia,反對全國各中小學裝冷氣！抗熱應有更好、更節能、更環保的方法。再者，孩子的身體調節能力會因為長時間吹冷氣而失調，引發致病。
No.16,2017-10-05 22:47:10,臺北市,士林區,Daphnie,
No.17,2017-10-05 22:56:10,新北市,新店區,dannylin,支持不裝冷氣來改以綠化…節能減碳…來讓我們下一代能夠更堅強的面對環境~
No.18,2017-10-05 22:59:11,臺北市,文山區,身入太極,支持，不僅省錢還可以激發學生的創意
No.19,2017-10-05 23:14:28,臺北市,大安區,黃鈴諭,
No.20,2017-10-05 23:14:53,高雄市,左營區,Huang yu fei,"請不要花了大錢裝冷氣，卻是弱化了孩子的健康體質。
錢要花在有意義的智慧之舉！"
No.21,2017-10-05 23:26:48,新北市,永和區,巴斯,非常認同發起者的理念
No.22,2017-10-05 23:31:14,新竹縣,竹北市,Yinghsin,孩子不應該關在冷氣房裡
No.23,2017-10-05 23:31:40,臺中市,太平區,Muteness,
No.24,2017-10-05 23:32:31,新竹市,北區,Sophia ho,
No.25,2017-10-05 23:52:17,新竹市,北區,fanny,
No.26,2017-10-05 23:57:23,臺北市,士林區,"AprilLiu ",
No.27,2017-10-06 00:03:56,花蓮縣,吉安鄉,花蓮林,支持提案，把錢用在更有價值的地方
No.28,2017-10-06 01:07:17,新竹市,東區,阿達,"裝冷氣不是唯一解決方法
大家運用想像力一起來想辦法！

高緯度國家可以有雪地課程
我們這個熱帶島嶼國家 為何不能把「熱」當成我們的資源來上課？

也許有些人認為要官員、大人帶頭做，學校或孩子再做
也許有些人認為都那麼熱、上課都是問題了，還想什麼辦法？
也的確很多家長會擔心孩子熱、擔心學習效率

但我的工作是教育領域
我知道孩子與學校是創造無限可能的地方！
兒童階段的心靈和身體也是最有彈性的階段！

如果我們直接選擇冷氣作為解決之道
那會是最方便，但絕對不是最好的方法！
而且孩子學習效率差，絕對不只因為熱、因為需要冷氣！"
No.29,2017-10-06 01:44:46,新北市,新店區,"Terpsiphone ",
No.30,2017-10-06 05:12:32,新北市,中和區,Stiv,
No.31,2017-10-06 06:26:12,金門縣,金沙鎮,錦沅,
No.32,2017-10-06 06:34:10,基隆市,安樂區,凱洛特,"完全同意，
只在學校裝冷氣，是很直接....
不過，不只效率差，也是個每年燒錢火坑...
事倍功半的事，我不***...
不是要激發創意嗎？
解決問題就需要創意...
解決前人沒認真想過的就要大創意...
如學校都為公有地...屋頂是種電的好地方... 
把原來耗費電能的阻力光源，
轉化為輔助發電的助力光源...
一來一回不是助益甚大...
還沒論省下發電量的污染避免..."
No.33,2017-10-06 06:43:37,苗栗縣,頭份市,Jojo,
No.34,2017-10-06 06:57:03,新竹縣,竹北市,Amy,
No.35,2017-10-06 07:15:40,高雄市,苓雅區,許小馨,
No.36,2017-10-06 09:06:56,新北市,板橋區,Cindy Liu,
No.37,2017-10-06 09:14:07,新北市,新店區,莘兒,冷氣房為密閉空間，容易傳染疾病。孩子頻繁出入冷氣房也容易感冒。應鼓勵校園多種樹，孩子下課後到有樹蔭可以玩耍，才能健康和避免近視。
No.38,2017-10-06 09:28:36,臺中市,太平區,楊柳樹,多種樹，多建環保綠化建築物
No.39,2017-10-06 09:29:07,臺北市,松山區,Yvonne lee,孩子滿頭汗頻繁出入冷氣房也容易感冒
No.40,2017-10-06 09:42:38,彰化縣,和美鎮,huichan,校園多種樹也能有效降溫，別在溫室裡養國民。
No.41,2017-10-06 09:44:09,臺中市,東區,Sylvia Huang,
No.42,2017-10-06 09:44:42,基隆市,七堵區,芒果,順應自然
No.43,2017-10-06 10:12:51,高雄市,左營區,水母君,"我覺得並沒有裝設冷氣的必要，你裝了也不是每個學生都會繳錢，再說現在很多靠著鑽法律漏洞得到中低收入戶證明的人他們一定不用像沒有這些證明的人繳一樣價錢，那是不是就苦了這些沒有特殊身份的學生家長了？
我們以前也是很熱，也是沒有冷氣還不是撐過來了？
如果每一間學校都要裝設冷氣，那經費要多少？學校都沒錢更新課桌椅更新器材了我寧願你把這些經費分攤給學校做更新設備"
